Address	Arkham - Entity	Arkham - Twitter	Arkham - Tags
0xc055de577ce2039e6d35621e3a885df9bb304ab9			OpenSea User, Contract Deployer
0x3cf4db4c59dcb082d1a9719c54df3c04db93c6b7			
0xa7c82885072badcf3d0277641d55762e65318654			
0x6e3fddab68bf1ebaf9dacf9f7907c7bc0951d1dc			MultiSig / Contract Wallet, Gnosis Proxy, Early ANIME Holder, MultiSig / Contract Wallet, originswap.eth Prev. Owner, originstrategist.eth Prev. Owner, originstaking.eth Prev. Owner, originvault.eth Prev. Owner, originoracle.eth Prev. Owner, origingovernor.eth Prev. Owner, origintimelock.eth Prev. Owner, originether.eth Owner, xogn.eth Owner, ogn.eth Owner, primestaked.eth Owner, ousd.eth Owner, woeth.eth Owner, wousd.eth Owner, originsupport.eth Owner, originprotocoltoken.eth Owner, ogvstaking.eth Owner, originflipper.eth Owner, claimveogv.eth Owner, originstore.eth Owner, veogv.eth Owner, originid.eth Owner, originteam.eth Owner, ognstaking.eth Owner, stakeogn.eth Owner, origintoken.eth Owner, stakeogv.eth Owner, originharvester.eth Owner, originmarketplace.eth Owner, origindripper.eth Owner, worigineth.eth Owner, origineth.eth Owner, originprotocol.eth Owner, originsale.eth Owner, ogv.eth Owner, claimogv.eth Owner, originmarket.eth Owner, origindollar.eth Owner, originbuyback.eth Owner, originarbitration.eth Owner, ogv.eth Manager, originarbitration.eth Manager, originid.eth Manager, originsale.eth Manager, originharvester.eth Manager, originflipper.eth Manager, originprotocoltoken.eth Manager, origindollar.eth Manager, originstore.eth Manager, originsupport.eth Manager, veogv.eth Manager, ousd.eth Manager, originmarketplace.eth Manager, wousd.eth Manager, origindripper.eth Manager, origintoken.eth Manager, originprotocol.eth Manager, worigineth.eth Manager, woeth.eth Manager, origineth.eth Manager, originmarket.eth Manager, Early PRIMEETH Holder, Gnosis Proxy, Tokenized ETH2 Staker
0xf41f7febd6574fe0b08b999598df44f6b3e95006	Ondo Finance	https://twitter.com/OndoFinance	Tokenized ETH2 Staker
0x86d888c3fa8a7f67452ef2eccc1c5ee9751ec8d6			Contract Deployer, Tokenized ETH2 Staker
0xeadb3840596cabf312f2bc88a4bb0b93a4e1ff5f			Tornado Cash Depositor, Contract Deployer, Tokenized ETH2 Staker
0x8e02247d3ee0e6153495c971ffd45aa131f4d7cb			Contract Deployer, Early OUSD Holder, Early 1INCH Holder, Early SWRV Holder, Early UNI Holder, Snapshot Delegator to 0xC1aa82499Da8d37383F1E6d95De417ecF7514e7C, Tokenized ETH2 Staker
0xfd3a14471c6bc9244dc7d0b55706f64922b3044e			Early ANIME Holder, cognitiveillusions.eth, Beacon Depositor, Contract Deployer, cognitiveillusions.eth Owner, Early STG Holder, Tokenized ETH2 Staker
0x0dfb160a2adc3a33690259340e9f2c94b5a44154			
0x6980a47bee930a4584b09ee79ebe46484fbdbdd0			MEV, Tokenized ETH2 Staker
0x81c8052fc1f7117c5095bd040d9b814056a0d41b			
0xc9c9b0c71e90be1c5ff503000a4de5095bc33d7a			Tornado Cash Recipient, Tokenized ETH2 Staker
0xe6916f3b5585a16daed5df0a5a6389bf1d8ed431			Tokenized ETH2 Staker
0x94b0058cc348e52be0e13a55fdc1467b552588ea	@pdespe	https://twitter.com/pdespe	Individual, Individual, Individual, Individual, Individual, "rippersnapperx" on OpenSea, crimsontiger.eth, Validator, Contract Deployer, Beacon Depositor, ghostballers.eth Prev. Owner, killer3s.eth Prev. Owner, killer3s.eth Prev. Manager, bivouac.eth Prev. Manager, ballhogs.eth Prev. Owner, 3headedmonsters.eth Prev. Owner, bivouac.eth Prev. Owner, tri-state.eth Prev. Owner, 3scompany.eth Prev. Owner, ghostballers.eth Prev. Manager, ballhogs.eth Prev. Manager, 3scompany.eth Prev. Manager, 3headedmonsters.eth Prev. Manager, crimsontiger.eth Owner, tri-state.eth Manager, crimsontiger.eth Manager, Early HOP Holder, Early LUA Holder, Early UNI Holder, Early BANK Holder, Early STRDY Holder, Early RADAR Holder, Uniswap Governance Delegator, Tokenized ETH2 Staker, Individual, Individual, Individual, Individual, Optimism Governance Delegator, Individual
0xdac393866d9db115c11200324f36235a8ff04919			
0xf2b8c142edcf2f3cc22665cce863a7c9a3e9f156			OpenSea User, Contract Deployer, rugolini.eth Manager, rugolini.eth Owner, Early PSDN Holder, Early NEWO Holder, Ukraine Donations Donor, Snapshot Delegator to 0xde1E6A7ED0ad3F61D531a8a78E83CcDdbd6E0c49, Tokenized ETH2 Staker
0xa75b7c9781dd52298b3aa4c238a7fe84be90cbdf	@aurepa	https://www.twitter.com/aurepa	Contract Deployer, OpenSea User, Contract Deployer, Early PEPE Holder, Tokenized ETH2 Staker
0x8372726b5a139987b806fc7a5f9b0ea3dfd4207d			
0x0fde32a92d1b4f2a182a757704facfb3f09478da			Contract Deployer, Early DWEB Holder
0x4197839e44788e080182e18e11d2c174c4f018d8			mexicanjoerogan.eth, "KBG89_2" on OpenSea, Contract Deployer, mexicanjoerogan.eth Owner, Early STG Holder, Early HOP Holder, Early PORK Holder, Early INS Holder, Tokenized ETH2 Staker
0x5e649b2c67379888ee7e00dfa8655e6f1be44eaa			Tokenized ETH2 Staker, Optimism Governance Delegator
0x85ab41be5ad20a72d9232f2c67327c394e586f41			
0x07e671c7d800c2fb99596ecce5e42a99919b8431	@linuschung	https://www.twitter.com/linuschung	"SerPounce" on OpenSea, Contract Deployer, wgmigm.eth Owner, serpounce.eth Manager, serpounce.eth Owner, wgmigm.eth Manager, Early X2Y2 Holder, Early SOS Holder, Early ENS Holder, Tokenized ETH2 Staker, Contract Deployer, ERC721 Token Deployer
0xa14ed585b6a4745caa6cc94952379853d93cb3d6			arjay.eth, OpenSea User, greathorn.eth Owner, fatstraw.eth Owner, peoplefun.eth Owner, lambdas.eth Owner, bambee.eth Owner, arjay.eth Owner, arjay.eth Manager, greathorn.eth Manager, fatstraw.eth Manager, bambee.eth Manager, peoplefun.eth Manager, lambdas.eth Manager, lphie.eth Manager, lphie.eth Owner, Early FARM Holder, Early BADGER Holder, Snapshot Delegator to 0xC1aa82499Da8d37383F1E6d95De417ecF7514e7C, Snapshot Delegator to 0xde1E6A7ED0ad3F61D531a8a78E83CcDdbd6E0c49, Tokenized ETH2 Staker
0xa7588225bbc97371c7165c1148c3a8d5f064c8c5			
0x0f9fde7ad57baf4197474cbde5ca8a07bf85fb3f			Early ALPACA Holder, Early EGG Holder, Contract Deployer, Early ILV Holder, Early TIDAL Holder, Early EBOX Holder, Early KNCL Holder, Early LQTY Holder, Tokenized ETH2 Staker, Contract Deployer
0xe6030d4e773888e1dfe4cc31da6e05bfe53091ac	@matthewliu	https://twitter.com/matthewliu	Individual, Individual, Individual, Early ANIME Holder, Individual, Individual, "matthewliu" on OpenSea, sudoswap Pool Deployer, Contract Deployer, matthewliu.eth Owner, umidoesnthaveany.eth Prev. Owner, umifox.eth Prev. Owner, umifox.eth Prev. Manager, mattliu.eth Owner, matthewliu.eth Manager, umidoesnthaveany.eth Manager, mattliu.eth Manager, Early ENS Holder, Early PRIMEETH Holder, Early DOG Holder, Early SOS Holder, Early GAS Holder, Individual, Individual, Individual, Individual, Individual
0x69fcca16859b75e37cb4846d6b03915aef650f07			Early AXIAL Holder, Early ACRE Holder, Early ANIME Holder, OpenSea User, Early APY Holder, Early LUSD Holder, Early ELF Holder, Early AST Holder, Early SOS Holder
0x68a611ed2791ffffa54b5d107eb8e567171b3251	@kohkim	https://twitter.com/kohkim	Individual, Individual, Individual, Early ANIME Holder, Individual, Early WSG Holder, Individual, "starshine" on OpenSea, kohkim.eth, Contract Deployer, kohkim.eth Manager, kohkim.eth Owner, Early FEI Holder, Early SOS Holder, Early TRIBE Holder, Tokenized ETH2 Staker, Individual, Individual, Individual, Individual, Individual
